{
  "accelerators": [
    {
      "kind": "gpu",
      "memory_architecture": "unified",
      "name": "Advanced Micro Devices, Inc. [AMD/ATI] Renoir (rev c7)",
      "vendor": "AMD",
      "vulkan_device_type": "integrated_gpu",
      "vulkan_driver": "radv",
      "vulkan_name": "AMD Unknown (RADV RENOIR)"
    }
  ],
  "collected_at": "2026-08-27T09:17:50.495452Z",
  "cpu": {
    "logical_cores": 12,
    "model": "AMD Ryzen 5 4600H with Radeon Graphics",
    "physical_cores": 6
  },
  "memory": {
    "total_bytes": 16102428672
  },
  "platform": {
    "architecture": "x86_64",
    "distribution": "Ubuntu 22.04.5 LTS",
    "distribution_id": "ubuntu",
    "release": "6.8.0-136-generic",
    "system": "Linux",
    "version": "#136~22.04.1-Ubuntu SMP PREEMPT_DYNAMIC Fri Jul  3 16:29:11 UTC "
  },
  "power": {
    "cpu_governor": "schedutil"
  },
  "schema_version": 1,
  "software": {
    "cmake": "cmake version 3.22.1\n\nCMake suite maintained and supported by Kitware (kitware.com/cmake).",
    "compiler": "c++ (Ubuntu 11.4.0-1ubuntu1~22.04.3) 11.4.0\nCopyright (C) 2021 Free Software Foundation, Inc.\nThis is free software; see the source for copying conditions.  There is NO\nwarranty; not even for MERCHANTABILITY or FITNESS FOR A PARTICULAR PURPOSE.",
    "configured_backend": "vulkan",
    "cuda_compiler": null,
    "llama_bench": "usage: llama-bench [options]",
    "llama_bench_path": "llama-bench",
    "llama_cpp_revision": "4d19b287691e8f47fc303be420f630c40ec45684",
    "python": "3.10.12",
    "vulkan": "==========\nVULKANINFO\n==========\n\nVulkan Instance Version: 1.4.313\n\n\nInstance Extensions: count = 23\n-------------------------------\nVK_EXT_acquire_drm_display             : extension revision 1\nVK_EXT_acquire_xlib_display            : extension revision 1\nVK_EXT_debug_report                    : extension revision 10\nVK_EXT_debug_utils                     : extension revision 2\nVK_EXT_direct_mode_display             : extension revision 1\nVK_EXT_display_surface_counter         : extension revision 1\nVK_EXT_surface_maintenance1            : extension revision 1\nVK_EXT_swapchain_colorspace            : extension revision 4\nVK_KHR_device_group_creation           : extension revision 1\nVK_KHR_display                         : extension revision 23\nVK_KHR_external_fence_capabilities     : extension revision 1\nVK_KHR_external_memory_capabilities    : extension revision 1\nVK_KHR_external_semaphore_capabilities : extension revision 1\nVK_KHR_get_display_properties2         : extension revision 1\nVK_KHR_get_physical_device_properties2 : extension revision 2\nVK_KHR_get_surface_capabilities2       : extension revision 1\nVK_KHR_portability_enumeration         : extension revision 1\nVK_KHR_surface                         : extension revision 25\nVK_KHR_surface_protected_capabilities  : extension revision 1\nVK_KHR_wayland_surface                 : extension revision 6\nVK_KHR_xcb_surface                     : extension revision 6\nVK_KHR_xlib_surface                    : extension revision 6\nVK_LUNARG_direct_driver_loading        : extension revision 1\n\nInstance Layers: count = 3\n--------------------------\nVK_LAYER_INTEL_nullhw       INTEL NULL HW                1.1.73   version 1\nVK_LAYER_MESA_device_select Linux device selection layer 1.3.211  version 1\nVK_LAYER_MESA_overlay       Mesa Overlay layer           1.3.211  version 1\n\nDevices:\n========\nGPU0:\n\tapiVersion         = 1.3.255\n\tdriverVersion      = 23.2.1\n\tvendorID           = 0x1002\n\tdeviceID           = 0x1636\n\tdeviceType         = PHYSICAL_DEVICE_TYPE_INTEGRATED_GPU\n\tdeviceName         = AMD Unknown (RADV RENOIR)\n\tdriverID           = DRIVER_ID_MESA_RADV\n\tdriverName         = radv\n\tdriverInfo         = Mesa 23.2.1-1ubuntu3.1~22.04.4\n\tconformanceVersion = 1.2.7.1\n\tdeviceUUID         = 00000000-0300-0000-0000-000000000000\n\tdriverUUID         = 414d442d-4d45-5341-2d44-525600000000\nGPU1:\n\tapiVersion         = 1.3.255\n\tdriverVersion      = 0.0.1\n\tvendorID           = 0x10005\n\tdeviceID           = 0x0000\n\tdeviceType         = PHYSICAL_DEVICE_TYPE_CPU\n\tdeviceName         = llvmpipe (LLVM 15.0.7, 256 bits)\n\tdriverID           = DRIVER_ID_MESA_LLVMPIPE\n\tdriverName         = llvmpipe\n\tdriverInfo         = Mesa 23.2.1-1ubuntu3.1~22.04.4 (LLVM 15.0.7)\n\tconformanceVersion = 1.3.1.1\n\tdeviceUUID         = 6d657361-3233-2e32-2e31-2d3175627500\n\tdriverUUID         = 6c6c766d-7069-7065-5555-494400000000"
  },
  "system_id": "honor-magicbook16-amd-16gb"
}
